,cid,status,user_name,movie_code,votes,rate_stars,date,content,add_time,customer
0,1348293405,1,影志,4920389,9782,5,2018-03-27 23:02:34,斯皮尔伯格把他对电影的梦想、热心、爱与情怀，浓缩到这部片子，通过极具年代感的经典电影和角色，又并茂高科技的现代游戏闯关，他拿手的、专注的、想诉说的都在这里给影迷情倾盆呈现，并在最后一句“谢谢你玩我的游戏”推向高潮，就像在银幕前看着他对我们说“谢谢你看我的电影”…泪奔,2018-09-21 14:56:32.932675,0
1,1345018216,1,翻滚吧！蛋堡,4920389,8454,5,2018-03-21 17:08:18,游戏宅和影迷的春药！还原《闪灵》那场戏看到要爆炸了！值得去电影院刷十遍！,2018-09-21 14:56:33.020567,0
2,1348402447,1,凌睿,4920389,6273,5,2018-03-28 08:35:46,请不要在彩蛋期间插播电影！（普通导演是在电影期间插播广告，二逼导演是在广告期间插播电影，文艺导演是在电影期间插播彩蛋，牛逼导演是在彩蛋期间插播电影） 层出不穷的惊喜和反转，无处不在的彩蛋和致敬。这是导演送给影迷的最好礼物，也是他写给电影的一封情书。片尾无彩蛋，因为电影本身就是彩蛋,2018-09-21 14:56:33.026721,0
3,1346991805,1,杨欢喜Metiche,4920389,5693,5,2018-03-26 23:47:07,全场喊牛逼！没啥是斯皮尔伯格做不到的了，在一个商业片中把所有的特效情怀和爱结合得完整而彻底，让影迷乐迷游戏迷接二连三地高潮，即使都不是也能看得花枝乱颤，这样应该算是完美了吧。而最后也竟然默默抹了把眼泪…Reality is the only thing that is real.,2018-09-21 14:56:33.032252,0
4,1349303778,1,觉,4920389,4885,3,2018-03-30 00:53:26,走马观花的IP大赏，剧情人物基本不通，鸡汤也撒得不知所云。适合跟塑料姐妹们一起假嗨,2018-09-21 14:56:33.036727,0
5,1350383009,1,大島,4920389,5285,5,2018-03-31 22:52:01,好想在有生之年玩一场全民大战马化腾,2018-09-21 14:56:33.041679,0
6,1345079255,1,风间隼,4920389,4849,5,2018-03-21 19:45:37,公民凯恩串起了闪灵、鬼娃、高达、哥斯拉、亚基拉、街霸、铁巨人、金刚、龟波气功……，加上迪斯科音乐和各种游戏卡，简直是是一部全球世纪流行文化编年史。感谢撕皮儿剥壳，把我们这些大孩子一把拉回追看《回到未来》和《夺宝奇兵》的神奇年代，跟着逼真的特技和癫狂的想象去重温我们的“玫瑰花蕾“。,2018-09-21 14:56:33.046095,0
7,1349220486,1,桃桃淘电影,4920389,4302,4,2018-03-29 22:22:43,9。我爱这部电影，就好像我的梦想是能进入马丁·斯科塞斯的《出租车司机》，看罗伯特德尼罗枪杀嫖客和鸡头，营救朱迪·福斯特。所以，我爱这部电影。,2018-09-21 14:56:33.050625,0
8,1349384439,1,天蝎小猪,4920389,3754,5,2018-03-30 09:35:38,这片讲述了“绿洲五人组”寻找终极彩蛋之旅：第一关告诉你，有时退一步，就是海阔天空；第二关告诉你，人生很短暂，关键的一步一定要迈对；第三关告诉你，不以输赢论英雄，找到乐趣、享受人生；最终关告诉你，别沉迷，活在当下。片中各种游戏、动漫、影视彩蛋信息量太大，必须多刷！,2018-09-21 14:56:33.055713,0
9,948768567,1,法兰西胶片,4920389,3394,5,2018-03-19 23:08:06,它是你们的情书，我的命。,2018-09-21 14:56:33.060033,0
10,1348410560,1,看电影吧,4920389,2214,1,2018-03-28 09:07:03,好莱坞把圈钱手段做到了极致，情怀，英雄，动漫，怀旧，复古只要能圈钱，什么都行，这部片子，就像一个大杂烩，让任何人都能找到曾经喜欢的东西，可是太着痕迹，梗已用烂，让人审美疲劳了，总是卖这些，一次两次行，次次这样，也不怪好莱坞特效片子在国内票房越来越不举。,2018-09-21 14:56:33.065128,1
11,1343899702,1,羚羊的灵魂,4920389,2591,5,2018-03-19 13:21:14,恕我直言，比老斯会拍爆米花电影的人还没出生吧？玩梗玩的贼6，金刚、侏罗纪、异形、哥斯拉......闪灵那段更是惊艳到爆炸，惊喜一个接一个的来！还有能不能轻虐我们钢铁巨人啊，心疼死了～,2018-09-21 14:56:33.069296,0
12,1351399610,1,谢飞导演,4920389,1556,4,2018-04-02 17:07:38,     大开眼界！对我这个只玩过斗地主的电脑游戏盲来说，《头号玩家》的内容确是匪夷所思。年轻观众欢呼雀跃的无数“彩蛋”我常常无从辨识，一头雾水，但是观影体验仍然痛快、满足。比我小四岁的老导演斯皮尔伯格，如此旺盛的艺术想象力和娴熟才华，让人佩服不已。后半部渐显落套，也无可苛求。,2018-09-21 14:56:33.074426,0
13,1350338184,1,邓安庆,4920389,1577,3,2018-03-31 22:04:20,要哭了，每个友邻都是五星好评，而我羞愧地半路睡着了……就感觉故事蛮老套的，那些让人嗨的点，心里只是“哦”了一下。,2018-09-21 14:56:33.079064,0
14,1349054142,1,同志亦凡人中文站,4920389,1678,5,2018-03-29 16:10:12,堪比“黑客帝国”的虚拟与现实切换，但没有苦大仇深的哲学思考，而是带着娱乐至死的精神，把影视游戏各种流行文化致敬了个遍。和当初的E.T.一样，童心未泯的斯皮尔伯格不经意就开启了电影的未来。宅男宅女们，欢迎来到VR纪元！（最后还不忘勿沉迷的忠告，赞赞赞~）,2018-09-21 14:56:33.084023,0
15,1349619018,1,姨妈的鸭,4920389,1671,5,2018-03-30 19:03:20,就像第一次玩俄罗斯方块，那个竖条降落的时候的感觉。我没办法给出更高的评价了。,2018-09-21 14:56:33.088125,0
16,1349694234,1,王大根,4920389,1548,5,2018-03-30 21:35:26,太好看了，我们这一代人的文化真的全在里面了，2045年你们要是建不出这样的虚拟世界，新年钟声敲响的一刻我立马举枪自杀,2018-09-21 14:56:33.093390,0
17,1349632516,1,亵渎电影,4920389,1004,5,2018-03-30 19:36:00,斯皮尔伯格是世界上最伟大的导演，他早就无须用作品证明这点，但一不小心，这部电影又给大家证明了一次！我都不记得上次在电影里目不转睛的看完一部电影，对导演的想象力佩服的五体投地是什么时候了，无论是影迷和游戏迷都能从这部电影里看到满满的爱，无处不在的彩蛋又时刻在唤醒我们心底的这份爱。,2018-09-21 14:56:33.097396,0
18,1343974151,1,时间之葬,4920389,1448,4,2018-03-19 16:02:15,老男孩斯皮尔伯格或许借此片宣告了未来电影的走向，电影不再是用来看的，而是用来玩的,2018-09-21 14:56:33.103019,0
19,1344064267,1,蜉蝣,4920389,959,5,2018-03-19 19:28:06,每一分钟都是应接不暇的彩蛋，而且确定自己只看懂了一小部分。充分满足了影迷游戏迷科幻迷动漫迷。观影、电影、游戏三个空间的同一感太棒了。某个梗出来的时候简直惊喜得跺脚。现实的部分稍弱，但是不妨碍它妥妥的五星。,2018-09-21 14:56:33.107160,0
20,1349328684,1,就是本怪,4920389,962,2,2018-03-30 02:50:23,梗的设置就会给普通观众设置很大的门槛。这个电影最大的乐趣是找梗这也是影迷的嗨点。但是除了梗之外呢，故事太简单粗暴，主角光环太重，反派智商不够，打斗场面还不够炫，男女主也不够好看，你说让我怎么喜欢。还有这个组合的成员：黑人，女人，亚裔，小孩这阵容也是没谁了吧。,2018-09-21 14:56:36.583736,1
21,1348303263,1,芥末蘸酱,4920389,908,4,2018-03-27 23:19:17,斯皮尔伯格就是那个头号玩家。,2018-09-21 14:56:36.608034,0
22,1349560749,1,江寒园,4920389,853,3,2018-03-30 16:44:42,7分 目前豆瓣9.2一片溢美 不外乎精准搔到了影迷们的嗨点 让观影量变现为成就感。新浪潮及新好莱坞以后，电影导演不同以往的一点是有了电影史意识，能够在他们的作品中有意识观照以往的电影，这部不过斯皮尔伯格的游戏之作，流行文化拼贴彩蛋集合，过于讨巧，究竟难以掩盖内涵的平庸和故事的老套,2018-09-21 14:56:36.615206,0
23,1347251691,1,大聪看电影,4920389,841,5,2018-03-25 22:09:04,第二关《闪灵》剧情的引用，是斯皮尔伯格对已故老友斯坦利.库布里克最深沉感人的问候，整部电影出现的游戏和角色，是对游戏玩家最浪漫的情书。,2018-09-21 14:56:36.619922,0
24,1348822584,1,smee,4920389,778,2,2018-03-29 01:19:06,内部票，比公映提前两天看到。整个就觉得很幼稚无聊，大概一些nerds会很喜欢吧。电影结束响起稀稀落落的两三声掌声，也是蛮好笑的,2018-09-21 14:56:36.624974,0
25,1349515918,1,哪吒男,4920389,702,5,2018-03-30 15:06:49,希望豆瓣也出VR版吧，然后我们懒洋洋傻乎乎躺在精神病角落，在豆瓣电影top250撕逼，在无人问津的9点自说自话，阿尔法城说不定还有幽灵出没。小豆不能换钱，紫豆用户是传说，该电影无法访问是恶势力的封锁，大蛋和阿北是彩蛋。嗯，谢谢你，这些年玩过的豆瓣。,2018-09-21 14:56:36.630318,0
26,1349495827,1,马庆云,4920389,640,1,2018-03-30 14:17:48,言过其实，华而不实。,2018-09-21 14:56:36.636607,0
27,1348253856,1,大奇特(Grinch),4920389,569,4,2018-03-27 21:55:10,众里寻蛋千百度，玫瑰花蕾却在灯火阑珊处。“谢谢你玩我的游戏。”——谢谢你拍这样的电影。,2018-09-21 14:56:36.641795,0
28,1322900356,1,阿德,4920389,591,5,2018-03-20 13:26:58,老斯这次真是玩炸裂了，一部让游戏迷、科幻迷、影迷、动漫粉、电子乐迷燃爆的年度科幻神作，各种梗和彩蛋不刷个两三遍是看不过来的！！（已三刷，嘻嘻）,2018-09-21 14:56:36.645933,0
29,1349554784,1,JOJOORC/Z,4920389,516,2,2018-03-30 16:31:44,睡着了三次，所谓宅向的东西都是浮皮潦草的元素堆砌。我替环太2感到不值。媒体吹爆还要不要脸？,2018-09-21 14:56:36.651580,0
30,1350384707,1,张小北,4920389,475,4,2018-03-31 22:53:55,看完之后，完全没感觉到这个电影有140分钟……时间过得好快……,2018-09-21 14:56:36.656531,0
31,1349281304,1,小龙同学,4920389,507,2,2018-03-30 00:03:14,大失所望的一部电影，不知道那些用它502各种神片的吹捧者哪来的勇气，毫无诚意，套路满满,2018-09-21 14:56:36.660616,0
32,1349609468,1,乐山小佛,4920389,524,5,2018-03-30 18:38:18,不想说那些彩蛋，其实观感是不断下降的（闪灵部分除外），因为不满意斯皮尔伯格这个级别的人还在讨好观众。看完结尾就释然了。这个级别的导演，也只有他还在抱着“谢谢你来看我的电影”拍东西。,2018-09-21 14:56:36.665979,0
33,1344258574,1,乌鸦火堂,4920389,866,5,2018-03-20 01:31:58,全程：“卧槽！牛逼！哈哈哈！这也行？！燃爆！太帅了！”游戏、动漫、电影，复古流行文化的超级轰趴，梗多的数不过来，如果你是这方面受众，观影就会像嗑药一样爽，整部电影就是个大彩蛋，斯大爷姜还是老的辣啊，不剧透了，预告片展示的只是冰山一角，正片更多的惊喜！为了找梗也要二刷啊,2018-09-21 14:56:36.671124,0
34,1349189282,1,婴儿,4920389,456,3,2018-03-29 21:31:03,本来闪灵出来想给五星的。但是结尾太太太不给力了！一个这么牛逼的反乌托邦题材变成了警察抓坏人的过家家？拍了这么多就为了告诉大家“春节回家放下手机，多陪陪父母”？SHIT！,2018-09-21 14:56:36.675508,0
35,1349286182,1,朝阳区陆依萍,4920389,369,3,2018-03-30 00:12:18,电影还好，结尾不满意，绿洲应该毁掉吧！《闪灵》部分很精彩，但作为从小跳皮筋，看《情深深雨蒙蒙》，《男生女生》杂志长大的女孩子，想要真正get到《头号玩家》的high点，真的太难了...#二刷又在影院体会了一下：孤单是一个人的狂欢，狂欢是一群人的孤单，所以散场后还蛮百感交集的#,2018-09-21 14:56:36.680444,0
36,1348266617,1,津五渡,4920389,420,5,2018-03-27 22:18:00,全方位牛逼，我甚至想不到任何一个给四星的理由。迷影为游戏服务，里面的迷影梗让人会心一笑，虽不玩游戏，但是里面的游戏情节也能让我热血沸腾。特别燃，抓住了游戏的精髓，团队和胜利，最感动的是足够关照现实，让生活更美好。远超被提高的预期，最后竟然泪目，已经分不清是感动还是兴奋。,2018-09-21 14:56:36.685287,0
37,1349247116,1,CyberKnight电子骑士,4920389,340,5,2018-03-29 23:04:58,简直不像70多岁导演作品！充满活力和创造性。对VR题材最出色的电影呈现。是对从80到2000年代电子游戏、桌游、动漫、摇滚乐、迷影等亚文化的巡礼！老斯鼎盛时期《夺宝奇兵》《侏罗纪公园》等之后又一经典商业片！除结尾略弱，主题不够深入等遗憾，可以说与《阿凡达》《疯狂麦克斯4》一样有着重要的意义,2018-09-21 14:56:36.690240,0
38,1349217240,1,恶魔奶爸Sam,4920389,329,3,2018-03-29 22:17:32,全世界对抗马化腾！,2018-09-21 14:56:36.694878,0
39,1350414834,1,马泽尔法克尔,4920389,296,5,2018-03-31 23:28:15,11岁男童看《闪灵》，这究竟是人性的扭曲，还是道德的沦丧？,2018-09-21 14:56:36.699797,0
40,1349095247,1,木卫二,4920389,282,4,2018-03-29 17:45:23,情怀＋真理，无限彩蛋组成了爱游戏，我只爱Rosebud和237。237的调侃，忍不住在电影院笑出声了。尤其是剧透党，简直笑CRY。,2018-09-21 15:01:43.855212,0
41,1349381574,1,Arthur,4920389,311,2,2018-03-30 09:27:50,一星赛车一星闪灵，再往后就全是大人抓小孩的脑残戏码，何必非要照进现实，就不能好好做虚拟，然而这游戏也没法玩，Player1是单机没错但这主角光环也过头了，老歌老片老游戏我年纪太小情怀不来，看完电影的空虚倒是和打完一天游戏一致,2018-09-21 15:01:43.882387,0
42,1351016213,1,mlln,4920389,283,3,2018-04-01 22:40:43,我知道这个电影很用心地抛了很多回忆梗，但是......完全不是我的回忆啊。它要抛出一个葫芦娃、黑猫警长和太阳之子一起打架，我就给五星了。,2018-09-21 15:01:43.887147,0
43,1350488713,1,胤祥,4920389,218,3,2018-04-01 01:16:00,视听非常惊艳！甚至可能是今年最重要的代表电影潮流走向的作品，但整体而言全部毁在平庸套路的剧作上。关于VR如何在视听语言层面和思维层面影响电影，本片堪称迄今最佳例证。作为一部标准的青少年反乌托邦电影，迷影和大众文化的梗更多地带来的是令人厌恶的自恋，以及对反乌托邦主题的消解。,2018-09-21 15:01:43.893208,0
44,1349212477,1,SELVEN,4920389,303,5,2018-03-29 22:09:50,85/100 我和你们说，只花几十块人民币，就能享受到如此美好、诚意、动情、持续调动大脑的商业巨制，谁不去看谁就是傻子。虽然可能有些奇怪，但这部电影的泪点其实也很多，而且我衷心的感谢斯皮尔伯格，没有把这个献给几代娱乐粉丝的礼物变成一句全球化的口号。,2018-09-21 15:01:43.898205,0
45,1350526679,1,深巷卖樱桃儿,4920389,305,3,2018-04-01 04:08:04,别人都说好看的电影，你不能说一般般，不然就是杠精,2018-09-21 15:01:43.902416,1
46,1349227613,1,陀螺凡达可,4920389,216,4,2018-03-29 22:34:19,感叹的是斯匹堡把他那不变的童心和念旧情怀放置在如此具有时代感的科幻作品当中，看到最后甚至会为此动容。最牛逼的还是第二关，任何一个影迷都会臣服于那无与伦比的观影体验。,2018-09-21 15:01:43.908310,0
47,1349898153,1,Kat,4920389,213,1,2018-03-31 07:55:59,这哪是反乌托邦，这明明就是乌托邦：游戏里的妹子竟然真就一年龄相仿的妹子，你的队友全为了你的梦想而死，你成了新一代渣克伯格，抱着真人妹子玩各种play但是ban掉撸瑟们两天不许玩游戏，你是神。这完全他妈就一巨大的宅男春梦啊？！,2018-09-21 15:01:43.912332,0
48,1352867301,1,亚比煞,4920389,197,4,2018-04-05 12:48:20,其它都挺好。但是你拍了一部片，讲述了一个在游戏里找到挚友，搞到真爱，还一夜暴富成为人生赢家的故事，最后告诉我只有现实是唯一的真实，不觉得结论太苍白了吗？强行政治正确吧。,2018-09-21 15:01:43.917278,0
49,1344149864,1,舒农,4920389,243,3,2018-03-19 22:10:33,艺谋凯歌可以看看你们想要成为的人是怎么还可以有想象力的，尤其是艺谋。,2018-09-21 15:01:43.921475,0
50,1009273659,1,痞影人科莱昂,4920389,236,5,2018-03-29 21:48:06,准备把之前说过的关于斯皮尔伯格作品已然老气、工整之类的话统统收回，今晚计划着将老斯的头像挂在床头，跪着睡。几乎满足了对现代大片的一切想象，包括各种革新、致敬与彩蛋，第一把钥匙敬自己，第二把敬《闪灵》，第三把敬过往（像素游戏），绚烂至极终归于平淡。玫瑰花蕾的致敬梗让人看得热泪盈眶。,2018-09-21 15:01:43.925521,0
51,1344304966,1,阿哲系,4920389,232,2,2018-03-20 07:33:14,"我只是不理解斯导拍此部纯娱乐片的用意，有必要他来这么拥抱虚拟的，特效的，游戏的，娱乐的世界吗... “reality is real”, and there was none here. ",2018-09-21 15:01:43.930787,0
52,1349938246,1,胡九点,4920389,252,5,2018-03-31 10:09:38,这游戏卖98是真的亏,2018-09-21 15:01:43.935595,1
53,1346150097,1,Linnnnnnnn,4920389,229,5,2018-03-23 23:47:40,老爷子一出手，同档期电影都给跪下哭着叫爸爸,2018-09-21 15:01:43.939921,0
54,1353888363,1,frozenmoon,4920389,144,3,2018-04-06 20:13:02,看过了，标记一下，非常理解那些热泪盈眶的人，但是作为不玩游戏的人，看着真是唤起不了什么感情。,2018-09-21 15:01:43.943949,0
55,1351513080,1,艾小柯,4920389,148,4,2018-04-02 21:23:54,游戏迷燃爆，情怀党涕醉，二者之外娱乐度沁人心脾，情节人物什么的则皆不可深究。《闪灵》的设计最妙，夜店尬舞一段最美，但最难忘的却是那个图书馆管理员。,2018-09-21 15:01:43.949163,0
56,1345052372,1,OCT IO≯,4920389,213,5,2018-03-21 18:38:21,好看到炸啊！复古元素和各种老梗犹如核爆余波般一次次冲击着大脑皮层！人物剧情节奏等几乎都没短板，最关键能让你从头high到尾！太不容易了…果然霓虹人民在死宅文化和整个游戏发展史上占有举足轻重的地位…话说这片真的跟细田守的SW相当神似，聚众反抗的桥段满满既视感…东亚三兄弟这回又没带棒子…,2018-09-21 15:01:43.954090,0
57,1349785745,1,雨前羽街,4920389,152,5,2018-03-30 23:39:18,这是一个老宅男珍惜好基友，而他的继任者为了女人每周关服两次的故事。怎么说呢，现充都得死！！！！！,2018-09-21 15:01:43.958678,0
58,1351098366,1,野象小姐,4920389,165,5,2018-04-02 00:31:00,三道关卡正好教会三个最重要的哲理。一是“退一步海阔天空”，二是“喜欢的女孩要勇敢吻下去”，三是“Real life is Real”。,2018-09-21 15:01:43.964583,0
59,1349988085,1,米粒,4920389,150,4,2018-03-31 11:53:15,亚文化不分国界，死宅世界为家，高达跳出来的时候全场欢呼哈哈，这电影给人感觉就像自己以前做的混搭大梦成真了。各种梗和彩蛋眼花缭乱，倒也能弥补剧情的相对老套。尤其闪灵那段实在是太有趣了，而且不管看没看过的观众都有被照顾到。如果我打这个游戏，估计就在第二关无限循环了！,2018-09-21 15:01:43.969092,0
60,1351445528,1,黄青蕉,4920389,130,4,2018-04-02 18:59:35,大导演的珍贵之处，在于可以任性的实现原本大家觉得不可能实现但又满心憧憬的东西，AKA造梦。斯皮尔伯格可以的，可爱度直逼李安了！,2018-09-21 15:01:44.740950,0
61,1351648253,1,曾良君,4920389,131,4,2018-04-03 01:43:54,没解释男主角是谁之前，我一直以为是最终幻想里的克劳德。,2018-09-21 15:01:44.786032,0
62,1342194667,1,玛丽莲·孟获,4920389,175,4,2018-03-19 19:38:54,好吧老贼，这次算被你煽到了…,2018-09-21 15:01:44.792742,0
63,1350938934,1,西楼尘,4920389,122,4,2018-04-01 20:55:57,穿上触感战衣，得到的是一种幻觉还是感觉；带上AR眼镜，进入的是一款游戏还是一个世界？凋败的现实里人们沉浸绿洲，去破解一场谜题，比拼一次竞速，体会闪灵凶宅的战栗，感受舞池狂欢的绚烂。这里人人都能变身，处处都可穿越。唯有红白机前的小孩没改变，关于她的回忆不能穿越，一个叫初心一个叫遗憾。,2018-09-21 15:01:44.798005,0
64,1349591017,1,肥肥鱼,4920389,159,5,2018-03-30 17:50:29,想打十星~越过华美彩蛋的海洋，回到最初角落里，男孩子、小电视和游戏机。那里是对世界想象的起源，打开窗不是灰暗天气，而是随时愿意启程的快乐与勇气。,2018-09-21 15:01:44.802861,0
65,1350024987,1,七颗栗子,4920389,122,4,2018-03-31 13:06:03,好莱坞毕竟理想，美少女线下依然是美少女，所以你才能回到现实。在工厂里，我曾听到几个年轻的流水线工人认真讨论着“团队合作”，细一听，是在讲游戏。我想对越来越多人来说，游戏和网络才是“回到”的地方。比现实的关系更提供归属感，比现实的工作更满足效能需求，比现实的你更不像机器。,2018-09-21 15:04:19.326537,0
66,1349730025,1,三心,4920389,152,4,2018-03-30 22:27:08,71岁，世界上地位最高的导演，拍出这样一部回归初心、畅想未来、嗨到极致的电影，值得敬佩。童心最宝贵，这是一部世纪流行文化编年史，也是属于斯皮尔伯格的玫瑰花蕾。我要是他，这辈子都没遗憾了。闪灵还原超赞，看到世上第一个游戏彩蛋那里开始泪目，还有关底的设计师童年小屋……戳心了。巨幕很爽！,2018-09-21 15:04:19.332149,0
67,1349828410,1,shininglove,4920389,108,4,2018-03-31 00:47:51,原来这世上有那么多人热爱《闪灵》。有人选择在废墟里重寻宝藏，在记忆里游戏穿梭，有人借用它当ID，十年如一日。终有一天，泪眼相聚。,2018-09-21 15:04:19.337072,0
68,1351481630,1,王小能,4920389,91,3,2018-04-02 20:21:26,视效很漂亮，共鸣感不高。导演用心肯定不坏，“游戏宅并不是鲁蛇，而是有革命性的年轻人来的”，最后依然要“小玩怡情大玩伤身”，反托拉斯的战斗精神弱到没有说服力。漂亮妹子脸上有个淡淡胎记不值得大惊小怪，阿尔忒弥斯在现实中真是个体重250住妈妈地下室的中年大叔才有意思不是吗？,2018-09-21 15:04:19.341456,0
69,1350398828,1,张嘟嘟,4920389,154,5,2018-03-31 23:09:54,想知道打一颗星的心路历程,2018-09-21 15:04:19.345798,1
70,1347636936,1,王写写,4920389,133,5,2018-03-26 16:53:15,牛逼疯了！看完浑身发抖！毁灭公爵！星际争霸！钢铁巨人！金刚！忍者龟！阿卡姆骑士！66年蝙蝠车！哈莉奎茵！甲壳虫汁！阿基拉！高达大战机械哥斯拉！回到未来的车和博士都出场了！猎空还有特写！以及老古董雅达利主机！真正的彩蛋狂欢！娱乐史的赞歌！好想在影院按下暂停键！主旨其实是防沉迷系统~,2018-09-21 15:04:19.351682,0
71,1350080502,1,渡边。,4920389,107,5,2018-03-31 14:55:49,还是那句话，美妙人生的关键，就在于你能迷上什么东西。而你在小时候迷过的游戏，年轻时爱上的电影，总会在某个时刻回到未来，带给你热泪盈眶的惊喜。,2018-09-21 15:04:19.356916,0
72,1348280393,1,谢谢你们的鱼,4920389,115,5,2018-03-27 22:41:32,140分钟爽满全场，电影中的人物找游戏彩蛋，银幕前的我们找电影中的彩蛋，斯皮尔伯格用60后喜欢的音乐与电影，8090后喜爱的动漫和游戏以及00后喜欢的视觉奇观创造了年度最炸裂的娱乐大片，画面想象力更是无边无际，震撼到下巴掉地上！,2018-09-21 15:04:19.361236,0
73,1350841933,1,AT,4920389,82,1,2018-04-01 18:09:00,以前的弱智片只是弱智，现在的弱智片还要假装自己关心族群联合与工人运动，为他们感到累,2018-09-21 15:04:19.366830,0
74,1348250249,1,不小可,4920389,122,3,2018-03-27 21:48:29,果然死宅的世界只有中二最懂,2018-09-21 15:04:19.372414,0
75,1135270710,1,外国乐器演奏员,4920389,105,1,2018-03-30 19:10:18,这部电影自带VR效果，因为整部电影本身就是一个在电影院里给女朋友科普你最喜欢作品里最不言而喻的梗的傻逼半吊子直男。一星给本爹。,2018-09-21 15:04:19.377235,0
76,1354919970,1,张天翼,4920389,82,5,2018-04-08 11:53:02,距离2045年只有27年了，好激动！到时我要去绿洲里的银翼杀手区和黑客帝国区爽到死。,2018-09-21 15:04:19.383682,0
77,1348118396,1,蒜 | BOY A,4920389,123,5,2018-03-27 16:30:25,彩蛋多到眼花缭乱，一场游戏、动漫、电影、科幻、电子乐的视听盛宴，想象力燃爆，随时都有惊喜随时都想尖叫。影片在现实和游戏间穿梭，既像一个万花筒，也是一个盛大的主题乐园和五彩斑斓的博物馆，既有对社会现实，科技未来，亲密关系的反思，但内核依旧是“孩童导演”斯皮尔伯格的“人本”和“童真”,2018-09-21 15:04:19.393034,0
