,cid,status,user_name,movie_code,votes,rate_stars,date,content,add_time,customer
349,1347823218,1,小慌,4920389,18,4,2018-03-26 23:19:13,对于很多人，一辈子最爽的游戏乃至人生体验，都是在童年时期。童年一消逝，快乐就成为难以寻觅的“玫瑰花蕾”。善于寻找的成年人不多，斯皮尔伯格算一个，他懂得快乐的秘密。,2018-09-21 15:04:33.970494,0
350,1350258324,1,拒绝者,4920389,21,5,2018-03-31 20:09:41,高达出场的那一刻，我差点从椅子里跳起来！感动,2018-09-21 15:04:33.974759,0
351,1349324236,1,凹凸,4920389,12,5,2018-03-30 02:19:23,Ben Mendelsohn的屁股好翘哦(重点错,2018-09-21 15:04:34.652214,1
352,1352603748,1,其实楠木可依,4920389,33,3,2018-04-04 22:44:17,挺有时代感的，而且也让人很期待绿洲，但是人物不太丰满，坏人投降莫名其妙的,2018-09-21 15:04:34.687118,1
353,1349211795,1,Alias,4920389,8,3,2018-03-29 22:08:41,我是真的没有童年 看懂了大概三个梗吧,2018-09-21 15:04:34.693753,1
354,1349394104,1,◆ hachi,4920389,8,5,2018-03-30 22:09:01,哈哈哈哈哈哈哈哈猎空的出现太可爱了！还有闪灵还原的一级棒红红火火恍恍惚惚。还有很喜欢的一句话就是游戏不要太在意输赢要懂得享受这才是游戏本身的意义！,2018-09-21 15:04:34.698327,0
355,1351009264,1,方苒生,4920389,14,5,2018-04-01 22:31:58,有生之年居然能在电影院看到3D imax版《闪灵》已经足够惊喜了，高达和波功拳出来的时候全场各种欢呼，真是又激动又感动啊,2018-09-21 15:04:34.703411,0
356,1349555571,1,小川叔,4920389,19,3,2018-03-30 16:33:29,想想如果未来活成这样，挺可怕的。第一次进入游戏之后我就担心，不会全场都是这种CG动画片吧？不过后来还好。片子特效不错，但情节真的是沉不进去，爱情来的就像龙卷风，友情也没那么燃，唯一剩下的就是，未来的世界也许就是这样~~好可怕。,2018-09-21 15:04:34.708332,0
357,1349758597,1,璐璐,4920389,13,5,2018-03-30 23:01:45,四星半，第三幕眼眶里的泪水不停地打转。其实一直是三星，到第二关的闪灵部分直接加满五星，是的，自从我爱上电影以后，我从没停止过做那样的梦，梦到自己出现在各种各样的故事里，拥有着不属于自己的人生。而这部电影，就是我的书本游戏迷影生涯缩影，再去回想，仿佛又看到了那个叛逆的自己。,2018-09-21 15:04:34.712986,1
358,1350997413,1,小水,4920389,10,4,2018-04-01 22:17:27,好看是好看，就是扒掉梗和视效之后剩下的东西太俗套了……,2018-09-21 15:04:34.718124,1
359,1351556685,1,春风不解意,4920389,33,4,2018-04-02 22:36:01,对不怎么玩游戏的人来说，就是看特效和情怀了。,2018-09-21 15:04:34.723858,1
360,1350038138,1,狮子青铜,4920389,20,2,2018-03-31 13:32:48,老人的特征就是失去了想象力，失去了对人性的兴趣，失去了创造力。这跟西科塞斯的狗屎雨果有什么区别。,2018-09-21 15:04:34.728144,1
361,1348271029,1,Morning,4920389,14,5,2018-03-27 22:26:33,谢谢你的推陈出新，让未来变得更有意义，科技是为了更好的延续传统，没有回应的感情也没有被时间打败。,2018-09-21 15:04:34.732916,1
362,1350313627,1,曼仔,4920389,13,4,2018-03-31 21:32:33,有野心且有完成度，真的是80年代流行文化迷，各种指涉戏仿太会心，致敬闪灵是最大的惊喜，对电影形式和观影体验的探索真的极有大导演的责任感。,2018-09-21 15:04:34.738043,1
363,1349348385,1,APTX-4869,4920389,27,2,2018-03-30 07:01:57,万幸女主声音好听？抱着link start的心态去看结果看到了傻子那开祖爷爷还没有bgm？闪灵出现的时候一排肥宅都笑了 亮灯后确认过眼神都是pipi P的受害者 如果把三次元镜头切除一半我大概会多给两星吧,2018-09-21 15:04:34.742441,1
364,1353103772,1,好姑娘老妖,4920389,8,5,2018-04-05 19:17:42,燃燃燃！好看！唤醒了埋藏在我内心深处的直男热血！,2018-09-21 15:04:34.746439,1
365,1351471896,1,华丽的春雨,4920389,24,5,2018-04-02 19:58:54,剧情很热闹，整部影片都是游戏带节奏，最最最主要的是女主角甚得我心，漂亮,2018-09-21 15:04:34.750535,1
366,1350535388,1,乱樂,4920389,27,4,2018-04-01 06:07:02,看的是一种情怀吧。男主最后的那枚复活币让我想到DNF(≧∇≦)/,2018-09-21 15:04:34.755668,1
367,1350154442,1,nobody,4920389,19,5,2018-03-31 17:10:16,"1.关于虚拟现实的讨论。是否应该选择那个完美的世界。
2.对理想的献身。所有人为了保护一片净土奋不顾身。
3.对经典的致敬。很遗憾我没有能理解很多的点。这对于某些人来说可能是一部感人的情怀片。
4.电影情节本身很完美。特别是当最后馆长的身份揭晓的时候。",2018-09-21 15:04:34.760756,1
368,1349194828,1,冰山的阴影,4920389,8,5,2018-03-29 21:41:31,电影止于阿巴斯，游戏止于斯皮尔伯格。,2018-09-21 15:04:34.765683,1
369,1359903691,1,司空看电影,4920389,7,4,2018-04-17 21:22:17,二次元和三次元的人物切换，让观众能够长久保持观影的新鲜感。但观影受众人群较趋于年轻人。剧情方面，有很多点让人意想不到，没有按传统套路形式。但最后结局回归传统的大团圆，而游戏对于现实意义的反省也被削弱。,2018-09-21 15:04:34.770003,1
370,1352055629,1,Eve|Classified,4920389,3,3,2018-04-03 22:32:54,"就……的确很斯皮尔伯格了……like an empty piñata. Although, 两处Serenity登场我还是比较开心的，第一次在大屏幕上看到宁静号。",2018-09-21 15:04:35.442338,1
371,1349315176,1,Doublebitch,4920389,8,5,2018-03-31 17:15:37,海贼王寻宝主题＋最终幻想系男主角，RX78一出全场沸腾，燃烧吧我的死宅之魂！,2018-09-21 15:04:35.485677,1
372,1349540287,1,谢青皮,4920389,28,5,2018-03-30 15:59:05,是这样子的，有些人觉得这个片子不值五星，一般来说这些人都可以拉黑了,2018-09-21 15:04:35.489736,1
373,1350221260,1,红豆♥,4920389,13,4,2018-03-31 19:08:15,一个孤独的程序员的一生,2018-09-21 15:04:35.494695,1
374,1349204212,1,渡口无边,4920389,13,5,2018-03-29 21:56:23,琳琅满目的视觉奇观与迷影游戏梗，戳中大脑皮层深处的记忆与感知神经网，几个段落瞠目结舌、爽到飞起又几近泪目。虚实世界通过多重文本相汇，也包含对虚拟世界和资本运作的哲思。感谢斯皮尔伯格这个老顽童，给所有影迷游戏迷极为真诚的、极致的一封情书。,2018-09-21 15:04:35.499722,1
375,1350406796,1,温言,4920389,15,4,2018-03-31 23:19:02,如果不是Acg迷如果没看过美国经典电影100部，你就会少很多乐趣,2018-09-21 15:04:35.504577,1
376,1350906512,1,男娼起义,4920389,5,4,2018-04-01 20:05:54,高达出来时，好感动，愿在现实世界，每个人也都可以成为想成为的人。,2018-09-21 15:04:35.509208,1
377,1349720709,1,艾薇森,4920389,8,5,2018-03-30 22:14:08,"全程高潮 早餐俱乐部直戳G点
(要是当初谈妥奥特曼版权就好了)",2018-09-21 15:04:35.514784,1
378,1350743698,1,青丝,4920389,12,4,2018-04-01 15:09:07,抵制不良游戏，拒绝盗版游戏。 注意自我保护，谨防受骗上当。 适度游戏益脑，沉迷游戏伤身。 合理安排时间，享受健康生活。,2018-09-21 15:04:35.522432,1
379,1349759108,1,l ǐ,4920389,16,5,2018-03-30 23:02:28,如果可以，我想打六颗星。,2018-09-21 15:04:35.527428,0
380,1349513489,1,普拉内托斯,4920389,7,4,2018-03-30 15:00:52,最初翻译小说的时候没想过还能在大屏幕上看到。虽然电影前半截蜜汁尴尬，但后面真不错，还有高达太他妈帅了。,2018-09-21 15:04:35.532343,1
381,1349562228,1,河狸,4920389,7,5,2018-03-30 16:47:49,中二青少年拯救地球。不过最后还得氪金和开挂。,2018-09-21 15:04:35.538187,1
382,1351156506,1,michaeeeel,4920389,16,5,2018-04-02 06:03:04,都5402年了网络还没实名制,2018-09-21 15:04:35.543903,1
383,1350133288,1,白羊先生,4920389,13,5,2018-03-31 16:33:02,我，他妈的，只想马上，看他妈的，第二遍！,2018-09-21 15:04:35.547884,1
384,1344027304,1,Jody.L 李九弟,4920389,12,5,2018-03-30 18:44:51,热泪盈眶。视效好到可以忽略剧情处处漏洞。答应我，游戏电影迷一定要去影院看好吗？在影院体验游乐园效果，它做到了。《闪灵》那段快从椅子上蹦起来了，又逼我指缝看。斯皮尔伯格也是流行文化象征，所以这片子还多了一重现实含义。这可能是其他人无法做到的。还能更好，尤其在深度上，期待新一代导演。,2018-09-21 15:04:35.551644,0
385,1355756584,1,Chris Tang,4920389,5,3,2018-04-09 22:15:07,电影里全民找彩蛋，电影外全民也在找彩蛋。电影里的三把钥匙分别对应着回到原点、遵从内心和放松心态，我想斯导的意思可能是，你们这些看电影的人，除了找点彩蛋证明自己，大概也已经忘记电影本身的乐趣了吧。,2018-09-21 15:04:35.555333,0
386,1349447788,1,XLX,4920389,13,5,2018-03-30 12:17:29,情怀又赢了！ 密码彩蛋 BO55man69 哈哈哈,2018-09-21 15:04:35.559043,1
387,1349932255,1,七曜日,4920389,17,4,2018-03-31 09:53:38,五个高玩血虐人民币玩家的故事,2018-09-21 15:04:35.562791,1
388,1350665923,1,新桥妖妖,4920389,8,4,2018-04-01 12:41:17,对科幻的臆想得到些满足，打打打！很是精彩纷呈了！,2018-09-21 15:04:36.221338,0
389,1348496684,1,惘然,4920389,13,4,2018-03-28 13:01:31,宅男要疯！就是戴着VR在影院和大家一起打了个大型闯关游戏啊！全程嗨爆！而且把影史很多梗都串了起来，公民凯恩、鬼娃新娘、闪灵、哥斯拉、高达……那哥们说《闪灵》是从指缝看的好有共鸣，我也是这样看的！#游戏宅男的玫瑰花蕾不是女人，而是他的兄弟！唉，男人啊！#,2018-09-21 15:04:36.278537,1
390,1349721163,1,昆汀的影子,4920389,11,3,2018-03-30 22:14:44,美版唐探2之贫民窟的亿万富翁。《论如何把情怀牌做到不让人反感》。爽但是没有爽到过脑不出的程度。国内口碑略夸张。想知道史蒂文是不是故意把男反取名诺兰的。二刷也就稳三星了。,2018-09-21 15:04:36.285801,0
391,1350237458,1,采铜,4920389,10,4,2018-03-31 19:36:09,谁能继承我的模因，谁就能继承我的遗产。,2018-09-21 15:04:36.289886,1
392,1348487788,1,微笑迦朵,4920389,9,4,2018-03-28 12:37:36,2018年已看051。1正确版本的“游戏健康忠告”；2这片子弹幕一定飞起；3作为非狂热游戏粉，还是电影梗更激动一些，异形和周末夜狂热，简直了；4最近几年，看老斯偏商业性的片子时，总想把他称之为“电影界的狄更斯”，到这部看尾声反派的一些反应，这种感觉就更强烈了。4看3D，要有光，好多好多光。,2018-09-21 15:04:36.293897,1
393,1347829587,1,蔡要要不吃药,4920389,8,5,2018-04-01 01:20:01,感动的嗷嗷叫,2018-09-21 15:04:36.298834,1
394,1347966585,1,T.V.Zoe ி,4920389,12,4,2018-03-30 23:35:02,谢谢你玩我的游戏  谢谢你看我的电影 谢谢你让我逃离这个世界  谢谢你让我回到现实  最后竟然看哭了猝不及防,2018-09-21 15:04:36.303993,0
395,1350948390,1,受受,4920389,13,5,2018-04-01 21:10:11,个人看法：Thank you for playing my game的时候电影就该结束了。,2018-09-21 15:04:36.308355,1
396,1351550012,1,水母母,4920389,10,5,2018-04-02 22:25:38,哈哈哈哈哈我还以为会出现奥特曼,2018-09-21 15:04:36.313423,0
397,1350096610,1,又是苟活的一天,4920389,14,5,2018-03-31 15:26:45,倾注一生的作品有人懂真是太好了，谢谢你玩我的游戏，谢谢你看我的电影，谢谢你了解我的想法。明明不是游戏狗却爆哭到停不下来的我，真是太奇怪了TAT,2018-09-21 15:04:36.318285,1
398,1351066856,1,Bob,4920389,6,5,2018-04-01 23:42:30,真他妈好了，但最后让我看得眼泪都出来的不是《终结者 2》，不是哥斯拉，不是高达，而是那枚“加一条命”的硬币，是那个黑瓷和男主站在那台电视前用雅达利专心致志的打着游戏。这片子告诉我们不要忘记对游戏的初心，单纯的，用你的心，ENJOY THE FUCKING GAME！！！！！,2018-09-21 15:04:36.324540,1
399,1348960125,1,风满蜃气楼,4920389,6,5,2018-03-31 22:51:47,啊啊啊啊太好看了嗷！想二刷！不过最后见到绿洲里的设计者幽灵，突然想到《贝克街的亡灵》了…//二刷没那么激动了，但视效和发展还是很燃。,2018-09-21 15:04:36.328508,1
400,1349808571,1,东林君,4920389,8,5,2018-03-31 00:13:57,怎么会有这么有钱的电影啊。看完后决定不冲王者了，顺其自然～,2018-09-21 15:04:36.333219,0
401,1352719988,1,邓莹,4920389,8,1,2018-04-05 02:21:11,电影开头部分“以退为进”还以为要讲道家哲学，但全片看下来其实并没有内容。这部电影的意义与《长城》一样，是西方导演集体沦陷的标志。特效并没有错，但是把特效当成内容，就明显是“美国梦”模式了，新的美国梦是用游戏来造梦，游戏就是新型毒品，让人不要思考只要幻想的快乐和幻想中欲望的满足。,2018-09-21 15:04:36.338517,1
402,1349737088,1,Enjoy,4920389,7,5,2018-03-30 22:36:08,穿着Joy Division看这个真是挺应景的,2018-09-21 15:04:36.343321,1
403,1353816791,1,浪,4920389,6,1,2018-04-06 18:40:16,抱歉，我依旧觉得斯导能看的电影只有辛德勒的名单，仅此一部。,2018-09-21 15:04:36.347909,0
404,1345704175,1,反眼失敗松果體,4920389,9,3,2018-03-23 01:20:23,免費先行放映，坐第三排。只懂很少彩蛋，不過不失又充滿童心。,2018-09-21 15:04:36.352751,0
405,1344446878,1,张晚禾,4920389,8,3,2018-03-31 14:49:49,如果称赞过去那些电影片段游戏情怀的伟大之处，那星星全给彩蛋，不想对这部电影的故事本身作任何称道。导演很会玩，没有一流的团队根本玩不动这些，我们在这方面的落差实在太明显了，是1和100的落差,2018-09-21 15:04:36.358980,0
406,1355942472,1,胡子大王,4920389,12,2,2018-04-10 10:22:35,如果全靠堆砌彩蛋就能拍出一部评分8.9的电影，那么我们这个时代的创造力究竟匮乏到什么地步了？,2018-09-21 15:04:37.282072,1
407,1161588141,1,friendbeast,4920389,5,4,2018-04-03 23:23:19,游戏以外的剧情又土又幼稚，讲明reality就是狗屎，找个自己当了现充就随心所欲地关服的人来代表宅宅，他配吗？,2018-09-21 15:04:37.391548,1
408,1353200852,1,我快乐我幸福,4920389,4,4,2018-04-05 21:21:27,科幻、夺宝、冒险，斯皮尔伯格将自己擅长的元素都运用到了影片之中,2018-09-21 15:04:37.399361,1
409,1358101122,1,东湖美景,4920389,4,4,2018-04-14 14:55:28,简直是彩蛋爱好者的盛宴.,2018-09-21 15:04:37.403935,0
410,1350948248,1,CountD,4920389,32,3,2018-04-01 21:09:59,内容空洞，情节幼齿,2018-09-21 15:04:37.408449,1
411,1349598658,1,盲忙,4920389,12,4,2018-03-30 18:09:45,很久没有看到这样让人大开眼界的电影了，即便从来不是游戏咖，那一刻我也很想去到游戏中。是不是一部游戏爱好者看完更会珍惜现实，非游戏爱好者看完开始想玩游戏的电影呢？太难想象近几年拍出林肯间谍之桥邮报这样暮气沉沉作品的死皮会突然大变身，惊喜惊喜。P.S.大反派为何叫诺兰呀哈哈。,2018-09-21 15:04:37.412972,1
412,1344035056,1,胡汉三_,4920389,6,5,2018-03-30 21:22:25,牛逼了我的老斯！视觉效果音效彩蛋致敬以及完整刺激不儿戏的剧情 近乎完美的电影！开头的赛车没high完就到了往后几百年都会被铭记的闪灵重现 还有玩家大混斗——初代高达跳出来时我鸡皮疙瘩都起来了！我最后肯定也会为男主他们喝彩的！因为像电影说的 游戏只是游戏 现实中的朋友才是最重要的。,2018-09-21 15:04:37.417494,1
413,1354624610,1,思考的猫,4920389,9,5,2018-04-07 21:45:06,情怀很足，对于影迷，PC和主机游戏迷，老摇滚迷会非常爽，在下三者都占了，看里面的梗此起彼伏实在过瘾。,2018-09-21 15:04:37.422421,1
414,1349206639,1,SleepWalker,4920389,6,5,2018-03-29 22:00:04,握草.......生生把我看湿了！高潮迭起停不下来！看完根本起不来好吗！！！梗和彩蛋遍地都是！这他妈不是梦这是真的！只要是热爱电影的人它就一定能满足你！当然观影量越大游戏量越大就会看的越爽！我感觉我已经语无伦次了！保底三刷，保底！！！斯氏老矣，尚能饭！感谢老斯，感谢你的童心！,2018-09-21 15:04:37.427446,0
415,1349716100,1,陪小主看电影,4920389,13,5,2018-04-01 23:10:03,恕我直言，原来彩蛋真的是个蛋。,2018-09-21 15:04:37.432188,0
416,1351341413,1,放开那个西红柿,4920389,8,3,2018-04-02 15:03:36,感觉一般，玩得游戏挺多的，但是却没嗨起来，不知道为啥，还是希望故事好一点。另外大部分影评都是彩蛋，希望看到对人物和结局的探讨（老人死了还是活着，绿洲的意义）什么的。个人看法，不一定对。不要骂我。,2018-09-21 15:04:37.436672,0
417,1349876905,1,Rayan,4920389,9,5,2018-03-31 04:04:59,我要猎空小姐姐的本子,2018-09-21 15:04:37.441195,0
418,1333796470,1,OreoOlymLee,4920389,10,2,2018-03-30 20:53:22,所谓虚构与现实孰益真实的讨论没有被深入讨论才不是这片最大的问题，而是它宣扬的、展示的其实也是一种“外人眼中的极客/死宅/游戏迷”，是一种依照其生存状态而想当然联想出的心理活动。极客需要回归真实么？当然不！由其可见它其实是一部“伪迷”电影，说不好听就是个戒网瘾宣传片而已。,2018-09-21 15:04:37.445836,0
419,1349332321,1,Zcc911,4920389,5,4,2018-03-30 03:23:33,故事连贯、内核童真、结局美好，致敬满目、诚意足够、混搭惊艳；注释字幕偏多、出现时间偏短，容易分散焦点，令人难以适从；首映送了海报，回程下了小雨，还好有塑料袋装着~,2018-09-21 15:04:37.450284,0
420,1351519580,1,占士鯊,4920389,9,3,2018-04-02 21:35:31,作为遊戲開發者我看得⋯情緒很平穩（。）話說反派的網友人真好啊，都要撲街了還安慰他「有朋友未算輸」，喜歡他（。,2018-09-21 15:04:37.454795,0
421,1348499317,1,维雪魂,4920389,16,5,2018-03-28 13:08:28,不好意思克制不住了，还是四星改五星吧。与其说没人比斯皮尔伯格更会拍爆米花，我倒觉得没人比他更懂怎么讲好故事给普罗大众。第三幕high到飞起，还少了老斯以往过度煽情的缺点。除了《闪灵》必补以外，大多数角色和电影稍微了解一下即可。,2018-09-21 15:04:37.459364,0
422,1350036570,1,五指毛,4920389,6,5,2018-03-31 13:29:49,斯老爷子告诉我们，电影不是媒体，电影就是电影;play是玩，是播放，是戏，是快乐，是人类的基本权利,2018-09-21 15:04:37.464003,0
423,1349570962,1,比落,4920389,31,3,2018-03-30 17:05:36,特效好，剧情烂，反派蠢，主角丑,2018-09-21 15:04:37.468710,0
424,1346688310,1,放开那个浪味仙,4920389,7,4,2018-04-01 15:09:56,七十多岁的老爷子还有这样的想象力真让人佩服，脑洞大开+情怀牌打动无数影迷。故事的主线相当老套了，电影很惊喜但是觉得没有传的那么神…心疼每一位要写“电影中100个/200个/300个彩蛋”的小编,2018-09-21 15:04:37.473655,0
425,1350370282,1,哈格兹,4920389,12,5,2018-03-31 22:39:13,燃死了！放到加一条命的时候都想起立鼓掌了！,2018-09-21 15:04:37.478249,0
426,1353290450,1,小周正在家躺着,4920389,6,3,2018-04-05 22:56:28,这么牛逼一个公司领导，办公室门咋都没锁的，不搞虹膜识别掌纹识别，至少整个门禁卡呢。还有那个智囊团是不是讽刺肥宅的,2018-09-21 15:04:38.636086,1
427,1016898274,1,何婊砸,4920389,7,4,2018-03-30 19:48:58,VR式沉浸感的游戏电影，《创战纪》加《勇敢者游戏》。《金刚》、《星球大战》、《哥斯拉》、《质量效应》……一部致二次元控、极客、欧美电影迷影人，高能怀旧彩蛋纷呈的未来感电影。看得好想玩游戏！本叔帅到翻车！！！Mark Rylance的扮相年轻了不少。找Tye Sheridan演戴镭射眼般眼镜的男主是因为他演了镭射眼吗？,2018-09-21 15:04:38.715779,1
428,1350285025,1,Oceannagirl,4920389,15,5,2018-03-31 20:51:05,全程都在讲彩蛋的电影竟然没有彩蛋？！,2018-09-21 15:04:38.731287,0
429,1349790112,1,Chain,4920389,5,5,2018-03-30 23:45:44,非IMAX会更关注剧情，“这是什么一根经的剧情”；然而如果看IMAX版本就不一样了：“卧槽！这画面，气势，高达屌炸天，剧情是什么，能吃么” 【真没看出来男主基友  是女的！女的！的！ （二刷，发现进闪灵电影院时出现穿帮,2018-09-21 15:04:38.743732,1
430,1356354011,1,钟螺,4920389,8,4,2018-04-11 01:09:39,爽片是爽片，但也是“都8012年了……”系列。令人气愤的地方是男女主背叛肥宅之后，挣着肥宅的钱，还要肥宅做现充，与马化腾也就半斤八两吧。FGO要是每周停服两天我立刻炎上运营，什么屌游戏,2018-09-21 15:04:38.752428,0
431,1370250303,1,笑书神侠倚碧鸳,4920389,5,4,2018-05-08 07:57:41,斯皮尔伯格对电影是真的热爱啊，这种与时俱进、这种各种元素的融入、这种对情怀的把握，好看得让人佩服！,2018-09-21 15:04:38.762986,0
432,1350044629,1,达斯佛™,4920389,8,4,2018-03-31 13:44:46,电子游戏从来都没有救过世界，是玩家拯救了电子游戏并改变了世界。,2018-09-21 15:04:38.768331,1
433,1349677843,1,阿白,4920389,19,5,2018-03-30 21:09:11,电影真好，可以造梦。,2018-09-21 15:04:38.776337,1
434,1350413661,1,路人Eita,4920389,5,4,2018-03-31 23:26:49,热血，友情，胜利，少年jump系的感动,2018-09-21 15:04:38.780888,1
435,1352921543,1,小A,4920389,9,4,2018-04-05 14:28:40,真不错，居然是老斯拍的。101是绿洲游戏生态里的衍生公司，借助闯关过程探索Halliday的人生经历，是我喜欢的本片两个高概念，但并没有完全贯穿全片。最后30分钟有点乱套。整体质量跟《夏日大作战》差不多。Mark Rylance是好演员。,2018-09-21 15:04:38.790087,1
436,1344238935,1,正义B胜,4920389,12,5,2018-03-20 00:33:22,也……太~~~~~~~~~~~~~~~~~好看了吧！！！！！！！！！！！！,2018-09-21 15:04:38.799758,1
437,1349558408,1,殇潮|Enigma,4920389,5,4,2018-03-30 16:39:40,本以为你斯皮尔伯格大爷要教教后生仔什么才叫迷影情怀和玩梗，没想到对游戏迷的意义远大于影迷。配角都超级可爱，高达的出现让非迷都为之一振，也是很厉害了。借着游戏人物的这张皮，给真人男主的戏份刚刚好，再多就要惹人嫌了,2018-09-21 15:04:38.806430,1
438,1350212506,1,Chance,4920389,15,3,2018-03-31 18:52:54,特效加两分，剧情扣三分，情节也太简单了吧？,2018-09-21 15:04:38.813259,1
439,1349873005,1,偏执狂,4920389,25,3,2018-03-31 03:29:40,只能说分数虚高 豆瓣电影人的狂嗨 可能我是抱着看剧情而不是找彩蛋的心态吧,2018-09-21 15:04:38.818353,1
440,1349690995,1,paradiso,4920389,8,4,2018-03-30 21:30:34,艹看了这个片子才发现除游戏外我怎么被80年代流行垃圾填鸭到这个地步，妈蛋Peter Weller那个片子多少人看过啊。讲真一个成长在当时的美国阿宅审美辐射全世界，怕怕。玩家暴起时twisted sister那个中二号子儿歌回家脑内响了一路(◎_◎;),2018-09-21 15:04:38.827041,1
441,1349505884,1,维城乱马,4920389,10,4,2018-03-30 14:41:49,也许是史上彩蛋最多的电影了吧，戏里戏外都在找彩蛋～,2018-09-21 15:04:38.834712,0
442,1350678916,1,虚弱橙,4920389,9,3,2018-04-03 07:54:03,没达到预期，剧本高开低走，本来进一步就成了VR时代的银翼杀手，现在退了一步变成了豪华版饥饿者游戏。明明已经看到了VR可能给未来人类在真实世界的生存处境带来巨大的负面影响，却不断用工业化的幽默桥段去消解掉这种严肃且紧迫的绝望感。电子游戏一开始也许只是游戏，但已经早就不是游戏了。,2018-09-21 15:04:38.840691,1
443,1351049373,1,仙仙美代子,4920389,5,5,2018-04-01 23:20:12,满分的爆米花电影，真人全息游戏设定，场面很刺激，赛车打斗超级经常，好像在看游戏cg，里面很多经典电影游戏歌曲等出现，虽然大部分我没看过，朋克元素也很多！唯一的缺点是人物不够美型，颜狗不满意,2018-09-21 15:04:38.845069,1
444,1350566757,1,枫林奕华,4920389,13,5,2018-04-01 09:04:27,看这个电影无需考虑什么剧情什么设定，你只需要惊叹斯老爷子天马行空的想象和追忆80年代的情怀即可，并在看完离场之后高喊真TM爽。,2018-09-21 15:04:39.862956,1
445,1303275252,1,喝口伏特加,4920389,14,4,2018-04-02 21:09:59,斯皮尔伯格作为一个72岁的老年人竟然可以染指游戏领域。。,2018-09-21 15:04:39.872289,0
446,1352986113,1,占黑小伙,4920389,6,5,2018-04-05 16:18:48,千军万马冲向死亡星球决战的时候 我他妈一瞬间觉得眼前都是豆友  脚都发麻了 没办法 谁让天天都有炸弹  高达是燃啊 可是谁能当得了 当不了高达 当炮灰也要拼命轧上一脚 各种彩蛋都集结成杂牌军呢 人还不能吗,2018-09-21 15:04:39.876957,1
