,cid,status,user_name,movie_code,votes,rate_stars,date,content,add_time,customer
161,1352063621,1,尉迟上九,4920389,32,3,2018-04-03 22:45:31,因《闪灵》带给我的短暂快感多加一星，半个游戏咖表示有些get不到点，花哨和酷炫之下还是好莱坞换汤不换药的那一套，整体有一锅乱炖的赶脚，话说看别人玩得巨嗨怪没意思的，某天要真能带上VR进入大爱的任何一部电影的情节或场景中亲身体验和实践玩上一把，那才过瘾。高达出现的一瞬间，集体卧槽了。,2018-09-21 15:04:25.076709,1
162,1333747817,1,冷月心,4920389,23,5,2018-03-30 23:51:32,超级好看！准备二刷！,2018-09-21 15:04:25.081552,1
163,1350071665,1,drunkdoggy,4920389,30,5,2018-03-31 14:38:00,“有人把《战争与和平》读出了肥皂剧的味道，而有人看着口香糖上的说明就悟出了宇宙的奥秘”,2018-09-21 15:04:25.085566,1
164,1350385189,1,丧失书宇兽,4920389,30,5,2018-03-31 22:54:29,网恋的故事 卧槽,2018-09-21 15:04:25.090225,1
165,1350654340,1,刮刮油,4920389,37,5,2018-04-01 12:18:01,梗太多……,2018-09-21 15:04:25.095267,1
166,1349484283,1,纤纤,4920389,38,3,2018-03-30 13:49:04,被过誉的电影，有好有坏，尚不足以封神。,2018-09-21 15:04:25.100007,1
167,1350374775,1,世界尽头,4920389,55,5,2018-03-31 22:44:01,看电影的过程中真的就感觉自己在打游戏，它的主题是游戏，全片的关键也是游戏里的通关和彩蛋。看完真叫人大呼过瘾，欲罢不能。好想游戏再来一局，看来要二刷了。,2018-09-21 15:04:25.105012,1
168,1350252093,1,死鬼,4920389,50,5,2018-03-31 20:00:31,"牛逼的导演就真的能把一个简单老套的故事拍出极致的浪漫感 让你一边猜到剧情的发展的同时一边无法自拔地深深地被打动
真的太好看了 真的太精彩了！！！
我真的觉得不去看会是有生之年的遗憾！
斯皮尔伯格怎么这么牛逼啊！！！
刷个十遍我都不嫌多！！！",2018-09-21 15:04:25.109829,1
169,1351323729,1,巴伐利亞酒神,4920389,32,4,2018-04-02 14:24:54,玩梗儿怎么是俗套呢，梗儿是文化，文化是沉淀，沉淀是情怀，情怀是让自己永远热泪盈眶的人和物。那个70多岁的老头尚且和他拍ET时一样童心未泯，你又有什么资格忘掉自己拯救世界的梦想呢？,2018-09-21 15:04:25.114874,1
170,1352297851,1,mumudancing,4920389,24,4,2018-04-04 12:50:06,技术是新的，创意是旧的。,2018-09-21 15:04:25.119765,1
171,1345239106,1,肥嘟嘟左卫门,4920389,41,4,2018-03-29 12:51:27,如果未来的游戏能做成这个样子，我倒宁愿在里面不出来了。尤其是还能亲历《闪灵》的经典桥段，可惜没买到杰克尼克尔森一家三口的版权。有哥斯拉高达Tracer双截龙与忍者蛙龟派气功，现在回想黑客帝国里的机器人其实很傻，干嘛做一个假的现实来囚禁人，做个这样乐不思蜀的世界轻松多了不是？,2018-09-21 15:04:25.124779,1
172,1351503871,1,Clarke,4920389,36,2,2018-04-02 21:06:41,不具有任何实践意义的结局，消解了前半程的热闹。叙述模式保守到吓人，青年白种男性与其他劣等性别和民族的人们一起完成了天选必胜之旅。拉鸡巴倒吧。你们说这是原著的锅？不不不，这是不吹不黑。,2018-09-21 15:04:25.128538,1
173,1350149062,1,sterdam,4920389,21,4,2018-03-31 17:01:27,设定有点新意，视觉有点爽到，剩下的，导演很老，故事很老套，价值观很老套，连配乐都是老套的。如果再剪短二十分钟，我会很情愿给四颗星。而现在，只能扭扭捏捏地给四颗星。看片时，感觉配乐的味道很熟悉，却又显然不是威廉姆斯的风格，最后看片尾字幕，原来是《阿甘正传》的Alan，都是老头子啦。,2018-09-21 15:04:25.132220,1
174,1349837337,1,陆冠均,4920389,40,5,2018-03-31 01:04:27,斯皮尔伯格这个年纪还能拍出这样的作品来，才有资格称得上是返璞归真,2018-09-21 15:04:25.136298,1
175,1351840984,1,小斑,4920389,18,5,2018-04-03 14:35:07,看！得！太！开！心！！了！！！,2018-09-21 15:04:25.141226,0
176,1022488291,1,文刀大土申,4920389,27,5,2018-03-30 23:19:01,还能说什么呢，改天二刷。,2018-09-21 15:04:26.342688,0
177,1354544888,1,陆钓雪的木乃伊,4920389,25,5,2018-04-07 20:02:19,但丁·斯皮尔伯格将古希腊-罗马的神话故事和中世纪传统的帕希法尔罗曼斯融合为一炉，成功达到了薄伽丘貌似寓教于乐实则宣扬享乐经验的文学精神，比较开心，多给一星。,2018-09-21 15:04:26.387435,1
178,1348336772,1,结冰,4920389,49,5,2018-03-28 00:19:24,不得了，斯皮尔伯格利用前沿科技打造了一部娱乐视觉大片，却没丢掉故事的情感内核。彩蛋一个接着一个，有一些些游戏梗没get到，但依然好看。,2018-09-21 15:04:26.402250,1
179,1350789212,1,熊阿姨,4920389,22,4,2018-04-01 16:33:03,对浸润在美国游戏文化里长大的人来说，这部片应该就是一种即将到来的真实世界。,2018-09-21 15:04:26.412401,1
180,1350553525,1,過期貓糧,4920389,28,4,2018-04-01 08:17:57,大龄死宅必看，秒秒钟都是成吨彩蛋，只恨电影没有暂停键。看到决战时从天而降的那位（就不剧透了），就好比我老婆看见金秀贤，激动得我简直要捂嘴痛哭！,2018-09-21 15:04:26.419993,1
181,1349691929,1,竹叶卷心,4920389,15,4,2018-03-30 21:31:59,还不错，虚拟与现实的结合，前半部分简直是特效的炫技。虚拟世界真的很有想象力。闪灵那段有点吓人和搞笑。,2018-09-21 15:04:26.424340,1
182,1348991955,1,赵启辰,4920389,32,5,2018-03-29 13:48:25,斯大叔这个年岁还能拍如此气质又情怀满满的片真是惊奇，致敬了多少款游戏和多少部电影已经数不清，融合了从六零后到九零后的情怀，没有任何导演能做到，商业电影的极致应该如此,2018-09-21 15:04:26.432559,1
183,1349768581,1,bibabo,4920389,32,5,2018-03-30 23:15:08,想象力和游戏万岁！索尼微软以及骨灰级的雅达利都齐了，任天堂是台词中被提到，主机阵营唯独少了昔日的世嘉，有点可惜。斯皮尔伯格真的太懂游戏和流行文化了，要说时代有什么不同，那就是小时候偷偷摸摸打游戏的人，现在有钱拍电影了,2018-09-21 15:04:26.437557,1
184,1350543539,1,夕梨,4920389,44,4,2018-04-01 07:27:48,不爱玩游戏，看之前还担心看不明白，结果出乎意料的好,2018-09-21 15:04:26.444427,1
185,1348333642,1,阿宇同学,4920389,38,5,2018-03-28 00:12:39,无尿点的好看，两个半小时恰到好处一点都不闷。虽然因为知识面的原因导致不能全部完美接梗，但是，完全不影响观影体验！大概是二次元和三次元人类能达成共识的一部电影。,2018-09-21 15:04:26.455374,1
186,1349677948,1,車神薛仔,4920389,56,3,2018-03-30 21:09:20,中间睡着几次，看完觉得还行。。闪灵那段比较牛逼。后段节奏有点崩,2018-09-21 15:04:26.460454,1
187,1349708357,1,五色全味,4920389,22,4,2018-03-30 21:56:13,迷影元素還是令人會心一笑的，尤其是《閃靈》重現和日本電影情懷，加一星。第三段又回到爆米花，打來打去看得好想睡覺。史屁飽還是太主流了，本質還是爆米花,2018-09-21 15:04:26.468838,1
188,1355482555,1,丁小云,4920389,19,4,2018-04-09 12:17:25,看完这部电影一周后再去想应该给这部电影打几星，估计会有很多人都会给本片少打一星乃至两星吧……,2018-09-21 15:04:26.474049,1
189,1354471781,1,袁长庚,4920389,16,4,2018-04-07 17:56:37,电子游戏世代的荷马史诗、劝善歌，价值观和手法都无甚新奇，但是游戏的这张皮真是精致如象牙微雕。看的时候特别感慨，这就是西方文化精英试图规劝下一代的努力，我们就造出杨永信这样的货么？,2018-09-21 15:04:26.482508,1
190,1353772865,1,般若儿,4920389,39,4,2018-04-06 17:33:44,特别精彩和刺激，尤其是闪灵的那段非常有代入感，游戏世界和现实生活的转换也很自然，导演和演员都很棒。就是有些部分看完后让人不太理解，这是一部值得多刷的电影。,2018-09-21 15:04:26.487153,1
191,1353915845,1,端木夜,4920389,40,4,2018-04-06 20:50:22,很精彩，结合动漫，很有意思。把游戏世界和现实生活连接在一起，好热血。,2018-09-21 15:04:26.492102,1
192,1215978540,1,su27根本就没有,4920389,28,5,2018-03-27 22:33:30,纯天然绿色零剧透无公害友邻就是在下。五星送给超会玩的斯大爷。,2018-09-21 15:04:26.500672,1
193,1349678310,1,小步捯饬着,4920389,35,4,2018-03-30 21:09:59,确实厉害，制作精良，现实与游戏世界的交互未来感很强，但这老头透露着一股对人性的过于乐观，大多数人沉溺于游戏并不是因为孤独，而是沉溺于游戏之后才变得孤独，脱离现实，梦想家毕竟是少数，大多还是逃避残酷现实的loser，就像最后没有开的那枪一样,2018-09-21 15:04:26.506055,1
194,1350118911,1,Luke,4920389,39,5,2018-03-31 16:09:29,希望微信周二周四也不能访问。,2018-09-21 15:04:26.511279,1
195,1351505555,1,阿汤,4920389,18,3,2018-04-02 21:09:54,现实很累，游戏也累，从虚拟回到现实，吃好一顿饭，并不见得就是一种解脱，回到现实中，人人都是现实的契约奴隶，照样过不好这游戏一样的人生。,2018-09-21 15:04:27.122326,0
196,1348458802,1,拐了,4920389,46,3,2018-03-28 11:20:56,还是一个标准、简单的好莱坞大片。,2018-09-21 15:04:27.153758,1
197,1349579390,1,明安,4920389,32,4,2018-03-30 17:23:05,哈哈哈梗真多,2018-09-21 15:04:27.164781,1
198,1349261829,1,萧秋水,4920389,39,5,2018-03-30 18:27:13,几年来还没有一部电影，像《头号玩家》这样让我完全投入其中，仿佛亲身经历了一场虚拟人生。作为一个在虚拟世界恋爱并在现实世界结婚的人，我的确对片中的情感有很深的认同。虚拟实境、极速飞车、生死探险、第二人生……融合了太多时代符号的这场大戏，简直就是一部文化发展史，光怪陆离、极致浪漫，故,2018-09-21 15:04:27.176287,1
199,1349217021,1,LORENZO,4920389,16,4,2018-04-03 05:19:06,游戏迷的盛宴，VR世界的终极形态，全程都在数玩过的游戏以及找彩蛋。觉得不够好的地方是第三把钥匙的获取，结尾的设定，以及文戏的过分浅显的对白。然而此外的部分，尤其是游戏的部分特别精彩。四星。,2018-09-21 15:04:27.187415,1
200,1350810452,1,西帕克,4920389,15,4,2018-04-01 17:11:42,正是因为《巴卡路班仔》所代表的那支亚文化的独特与特别，才可以让重新发掘这些的《头号玩家》如此火爆。观看这样的电影，也成了观众寻找同类的过程，我们曾经爱过，却不被其他人重视的事物，在这里成为了整个世界都在寻找的最高准则。在如同圣堂的好莱坞一级大片和黑暗的影院中，完成了一次洗礼。,2018-09-21 15:04:27.198698,1
201,1350719077,1,斑陀螺,4920389,17,4,2018-04-01 14:22:00,虽然看得很开心，但此片对游戏角色的使用态度更像是「大伽客串了群演」，真正把玩梗融入到剧情里的反而是闪灵钢普拉哥斯拉这样的影视IP。现实部分的戏和刺客信条一样鸡肋，最后的说教尬出天际，原本就是在现实过得不爽才逃去玩游戏的，你当了人生赢家就有脸说「现实比游戏更好」？,2018-09-21 15:04:27.209523,1
202,1349720695,1,所有团的团长,4920389,25,4,2018-03-30 22:14:07,记得以前曾经想策划过一个稿件，就是游戏和电影在未来的边界是否会越来越模糊。我觉得斯皮尔伯格的牛逼之处不在于埋了多少彩蛋，而在于预示了电影一种极有可能的未来。,2018-09-21 15:04:27.221219,1
203,1350504907,1,H!karu,4920389,19,5,2018-04-01 01:58:29,Hardcore nerds porn. ,2018-09-21 15:04:27.231934,1
204,1349329240,1,艾晨,4920389,27,4,2018-03-30 02:54:28,作为一个不专业的游戏行业从业者，给电影打四星；作为一个不专业的电影爱好者，给电影打三星。整体75分吧。《头号玩家》就像一台造梦机器，再现了很多人幻想中的场景；然而诸多的电影梗、游戏梗只是电影的热闹补充，再锦上添花，也不是电影本身。总之，“谢谢你来玩我的游戏。”,2018-09-21 15:04:27.243078,0
205,1351505599,1,红桃L,4920389,51,3,2018-04-02 21:09:58,"这部电影的评分其实很简单
对于游戏迷和欧美大片迷来说，无数的彩蛋让他们爽到了，那就是五星
对于不打游戏或偏爱文艺片的观众来说，他们get不到这些梗，看完后云里雾里的，那就是两星三星 ，顶多跟风四星
很不幸我属于后者...",2018-09-21 15:04:27.253559,1
206,1350478005,1,吃瓜少年,4920389,15,4,2018-04-01 00:54:49,信息量和致敬梗很多的爽片，立意也不错，寓教于乐比起说教更让人印象深刻,2018-09-21 15:04:27.261028,1
207,1341811352,1,席德,4920389,31,3,2018-03-30 14:18:18,人物形象单薄刻板，大东的存在就是为了出高达，修可以直接删掉没影响。经典文化元素应该是锦上添花，而不是压倒叙事、喧宾夺主，粗暴挪用文化符号的手法让我有种看春晚的错觉。谢里丹这样有才华的年轻演员，近几年又是演X战警又是演这个，总把时间花在这种“谁演都一样”的电影里，不应该啊。,2018-09-21 15:04:27.267215,1
208,1351607429,1,我要加油,4920389,47,3,2018-04-02 23:54:45,不要沉迷游戏了，可是现实生活中谁能做到,2018-09-21 15:04:27.271922,1
209,1333726996,1,荆棘,4920389,34,5,2018-03-31 10:08:23,"比较可惜的就是主角姨妈和渣男友的被害，女主的手下同样被抓去未归，处理的不太好。无政府主义的设定和突如其来的警察不合理。全民沉迷VR与粮食减产不深刻。除此，帅不过3秒高达，馆长硬币赌注，以及黑人队友与男主相认，笑哭。
其实，有时候我也想回到一会儿童年时无忧无虑打电动呢~愿世界和平。",2018-09-21 15:04:27.276345,1
210,1314998507,1,烟波人长安,4920389,28,5,2018-04-01 14:47:01,这货不是电影，这货是二次元的毛片啊！。。。,2018-09-21 15:04:27.281237,1
211,1350825307,1,冰山李,4920389,22,2,2018-04-01 17:38:08,大数据终将替代想象力 with Anana,2018-09-21 15:04:27.285785,1
212,1350918206,1,沈入忘,4920389,20,5,2018-04-01 20:24:09,好好看！！！ 看之前很担心不懂游戏梗能不能看懂，根本不用担心。因为理想，热爱，真诚，情感，每个人都是共同向往和拥有的。,2018-09-21 15:04:27.290139,0
213,1294419397,1,匡匡,4920389,11,4,2018-04-02 15:18:50,斯皮尔伯格不是拍电影，也不是拍彩蛋，是做标本。死扛着没瞧任何剧透，赶个早场去观摩了。同场还有两位走路颤巍巍、需要互相搀扶的老爷爷老奶奶，这股子勇猛贴近年轻世代文化的精神，着实可嘉。不过，说它是整整一代人的“流行文化”编年史，我可不咋赞同。最多是“御宅文化”的一次总动员。,2018-09-21 15:04:27.296316,0
214,1350330623,1,大燕威王~扑腾,4920389,20,5,2018-04-01 23:27:03,从一曲《I Hate Myself For Loving You》响起，全程高燃。看到高达了！好激动！斯皮尔伯格就属于那种商业片基本功非常扎实的人，我们的电影人应该多学习他，有情怀可以，但一定要招待好观众。,2018-09-21 15:04:27.301321,1
215,1349460196,1,今夕何夕,4920389,37,4,2018-03-30 12:49:12,本对游戏类电影不感兴趣，却意外得不错，科幻巨作，斯皮尔伯格还是厉害。,2018-09-21 15:04:28.183534,1
216,1349729588,1,大时代·歌姬,4920389,24,4,2018-03-30 22:26:31,"这真的是只有爱电影➕爱游戏的人才能做出来的电影。
光荣归于斯皮尔伯格，伟大归于电影和影迷！",2018-09-21 15:04:28.230124,1
217,1350962700,1,子文东,4920389,22,3,2018-04-01 21:31:09,买票时明明标了原声，现场居然是国语配音，巨坑无比…… 不过除去这个因素，还是感觉很一般啊。评分确实虚高太多了。,2018-09-21 15:04:28.241659,0
218,1350312327,1,周眠,4920389,15,5,2018-03-31 21:30:46,最赞+1s这个彩蛋。,2018-09-21 15:04:28.253224,1
219,1348446321,1,哟大豪爷,4920389,41,5,2018-03-28 10:51:19,彩蛋太多了！！！！！！,2018-09-21 15:04:28.265093,0
220,1348909218,1,饮歌,4920389,37,5,2018-03-29 10:28:37,精彩绝伦，难以言表！这部片子让我再一次相信电影是一门光影的艺术，再一次爱上了电影。在一个颓垣末世那么似曾相识的未来设定里，老斯巧手匠心得用VR的概念把科幻电影拍出了新的高度。那些琳琅满目的致敬和别出心裁的彩蛋，真的是不把影迷看到高潮不肯罢休！,2018-09-21 15:04:28.276624,1
221,1351264218,1,卒业之奏,4920389,34,3,2018-04-02 12:05:11,从红海开始 豆瓣的评分体系就已经崩塌了,2018-09-21 15:04:28.288082,1
222,1349613792,1,awty,4920389,41,1,2018-03-30 18:49:52,其实仔细想一想，这片真正和游戏有关的内容有几个？,2018-09-21 15:04:28.298696,1
223,948811559,1,安东,4920389,15,5,2018-04-06 23:09:26,一边嗨一边觉得悲哀：就算未来真有这么个牛逼游戏，我天朝玩家不翻墙估计还是登录不了。,2018-09-21 15:04:28.310582,1
224,1351394407,1,KREJERK,4920389,29,1,2018-04-02 16:56:18,一星半吧,2018-09-21 15:04:28.320949,1
225,1353198760,1,野子,4920389,23,5,2018-04-05 21:19:03,不能因为从来不玩游戏而少打一颗星，好电影光芒万丈。,2018-09-21 15:04:28.332289,1
226,1350765743,1,gegemoon,4920389,15,4,2018-04-01 15:49:56,斯皮尔伯格再任性，也还是要帮华纳强行植入各种DC元素。不过预算应该都花在特效上了，演员不是新人就是英国人，这次不舍得请汉克斯了。反派手下的人其实并不弱，主要都毁在boss自己身上了，也是很典型的傻逼老板。最后女主如果真的是中年宅男Chuck就太妙了哇。,2018-09-21 15:04:28.346999,1
227,1351366884,1,战将波舰金,4920389,18,3,2018-04-02 15:58:01,人类在过去二三十年里几乎没有任何新的想象，救赎被数字日益吞噬的孤独灵魂的，反而是仍旧是这些流行文化图腾，这难道不是最令人伤感的事情吗,2018-09-21 15:04:28.353997,1
228,1349342845,1,牛腩羊耳朵,4920389,19,4,2018-03-30 05:50:55,斯皮尔伯格对ACG二次元文化的总结和正名，特别是对游戏迷们来说就是狂欢，最后不忘防沉迷提醒广大玩家现充的重要性。各种梗多到来不及数的地步，有些“掉书袋”的嫌疑，第一关场面调度屌炸天，第二关迷影中的迷影情怀与还原度爆表，第三关大戏相比之下就略缺乏新意【头号玩家=人民币玩家】,2018-09-21 15:04:28.360275,1
229,1352235802,1,樂安,4920389,13,5,2018-04-12 10:40:09,特效很棒，剧情也在线，彩蛋桥段爆点都很赞。,2018-09-21 15:04:28.364865,1
230,1351282264,1,婷婷爱八卦,4920389,42,4,2018-04-02 12:51:02,科幻类电影的极致挑战了，反派略弱了一点,2018-09-21 15:04:28.369304,1
231,1350296059,1,2koo,4920389,16,4,2018-03-31 21:07:45,土豪氪金玩家大战腾讯。,2018-09-21 15:04:28.373962,1
232,1356537505,1,Bless_U,4920389,29,4,2018-04-11 14:29:24,要懂得走回头路，要懂得活在当下，要勇敢踏出每一步。虽然只看懂一半，但挺热血的，玩游戏就是找热血得感觉。,2018-09-21 15:04:28.377986,1
233,1351129508,1,左胸上的吸盘,4920389,17,3,2018-04-02 01:57:29,勉强及格。和慧在影院看的第一部片子。主线架构很俗了，寂寞有钱人的动机就是让别人去了解他，有点苦涩有点浅薄，这个层次连《海贼王》都比不上啊。全片精华是拿第一把钥匙的飞车戏，除了不少电影彩蛋在镜头上也有游戏感；以及最后召唤大军，缭乱的游戏人物里，钢铁巨人联合高达大战哥斯拉。别的无甚观,2018-09-21 15:04:28.382766,1
234,1350036544,1,草威,4920389,21,4,2018-03-31 13:29:46,1.退一步海阔天空；2.人最舍不得的是未能实现的愿望；3.最爱玩的人能有最多收获。斯皮尔伯格讲童心还是有一套。,2018-09-21 15:04:29.086560,1
235,1349510693,1,思郁,4920389,24,5,2018-03-30 14:53:42,太牛逼了，好莱坞第一大佬的称呼不是吹的，这就是写给自己电影生涯的一封情书，迷影者才会享受这美好的过程。,2018-09-21 15:04:29.108273,1
236,1348087387,1,瓦力,4920389,24,4,2018-03-27 15:14:55,这是资深电影电玩动漫迷的《达芬奇密码》+《黑客帝国》，也是史上彩蛋最多的电影，有IMAX加持戴上眼镜那刻就沉浸“绿洲”了，沉浸感超强，不过哈利迪谜题改得比原著还简单说不过去，只有主角牛逼其他玩家都是傻逼么...没看过《闪灵》没玩过相关游戏的观众会少一些乐趣。绿洲绝对是“奶头乐”的终极载体,2018-09-21 15:04:29.114981,1
237,1351822246,1,顾俏乜,4920389,12,5,2018-04-03 13:51:01,相当燃相当热血的一部片子。,2018-09-21 15:04:29.120292,1
238,1350425540,1,唐小万,4920389,18,3,2018-03-31 23:40:10,每年公司都要让我们做一个信息安全测试，其中一条就是千万不要把密码抄在纸上。,2018-09-21 15:04:29.124361,1
239,1349844116,1,大瘦瘦,4920389,41,3,2018-03-31 01:19:25,泼点冷水吧，我想我看完的震撼程度不如当年玩的金庸群侠传吧,2018-09-21 15:04:29.129216,1
240,1349819847,1,PomBom,4920389,18,5,2018-03-31 00:32:37,看完胸中有千言万语，一时也难以尽吐，只是走出影院，迎着回家路上的夜风，想到那句“谢谢你来玩我的游戏”，还是忍不住流泪。斯导已经七十二岁了，但这部电影让我觉得，他就是那个我从很小的时候就开始一直盼着的，理想中的最好的朋友。,2018-09-21 15:04:29.134321,1
241,1349876938,1,Ravan,4920389,39,3,2018-03-31 04:05:21,真的高达大战哥斯拉不常见的，能把烂剧本拍成这样斯皮尔伯格也是牛逼了,2018-09-21 15:04:29.139246,1
242,1354695507,1,注销,4920389,11,3,2018-04-07 23:11:02,不是科幻电影，没有任何世界观的贡献。Z手捧金蛋问哈利迪你是角色还是活人，只是再问一遍耶稣是神还是人。最高潮是坏到极致的大反派被主角一滴眼泪感化，更不用提剧本其他的槽点和俗套。斯氏自己的电影里前五也排不进去。如果这样的埋梗技术也要大呼小叫，那么看今敏得备两瓶速效救心丸吧？,2018-09-21 15:04:29.144125,1
243,1350934583,1,苹果派,4920389,46,4,2018-04-01 20:49:19,被闪灵吓到了，游戏玩的少，有些梗没get到，片子确实很酷炫。男主帅点就更好了。,2018-09-21 15:04:29.148965,1
244,1350781603,1,欢乐分裂,4920389,14,4,2018-04-01 16:18:32,非游戏控达成大银幕实战经验，在高度视效的世界里体验异次空间，VR化的现实在游戏里的倒映；各种梗眼花缭乱，van  helen热血开场，beegees撩人，JD惊鸿一瞥，高达赛高，最提神的当然是闪灵之复现，满身惊栗；“谢谢你们玩我的游戏”，回归现实也有温暖的拥抱。,2018-09-21 15:04:29.154020,1
245,1360720256,1,炫3D,4920389,10,4,2018-04-19 17:13:20,很新鲜的创意，身临其境的感觉，这就是斯皮尔伯格的电影,2018-09-21 15:04:29.158668,1
246,1351077818,1,舟菖蒲,4920389,15,4,2018-04-01 23:57:28,朋友曾说诗词的本质是“用典”。看完这部电影我觉得，游戏、网络论坛、以及所有亚文化中的玩儿梗本质上和用典是一回事，只有玩梗才可以保持与历史、传统的接续和对话，从而树立自身的边界。而如果没有这种接续和边界，无论流行文化还是古典文化，都将不复存在。,2018-09-21 15:04:29.163657,1
247,1351063304,1,Vamei,4920389,12,5,2018-04-01 23:37:46,梗都看不完,2018-09-21 15:04:29.168660,1
248,1350877247,1,陈哈,4920389,11,4,2018-04-01 19:15:25,内核是好莱坞大片百年不变的三观正。有人认为斯皮尔伯格开创了电影未来的拍法，我觉得没有，此片有创新，但创新不是发明，创新是将现有元素重新组合。也有人因为观众一边倒的好评而带着排斥情绪看片，刻意打低分，我觉得除了影响自己心情应该没有其他好处了，反正别人没损失。,2018-09-21 15:04:29.173721,1
249,1349336034,1,有心打扰,4920389,17,4,2018-03-30 04:03:38,影片实在太可恶了，它一层层挖开我的梦，电影、动漫、游戏...我想起了大学在宿舍里一个人在深夜里看《闪灵》，想起了中学时候看高达，也想起了小时候跟朋友在玩任天堂...在高潮迭起时，泪流满面。,2018-09-21 15:04:29.178650,1
250,1353319694,1,邓若虚,4920389,15,4,2018-04-05 23:26:36,斯皮尔伯格顺手提高了爆米花电影的入门标准——爆米花电影要拍得这样过瘾，才能算是良心之作嘛。斯皮尔伯格今年 72 岁了，72 岁的老头能把这些眼花缭乱的东西玩得这么溜，真是给这个世界增添了不少安全感。有人以这种方式来聊“死亡”这件事，也真够任性和别出心裁。如果库布里克还活着，会怎么样呢。,2018-09-21 15:04:29.183552,1
251,1349804356,1,银色bullet,4920389,19,5,2018-03-31 00:06:59,上线防沉迷系统你敢信？,2018-09-21 15:04:29.188471,1
